{
  "$comment": "Sandbox board for environmental combat (#201) — NOT content: it lives outside content/maps/, so nothing ships it and content:validate never lists it. The flooded ferry landing: two pilings, open water to wade, and room at the top edge for the rift's way out. Read by encounter-environment.test.ts and tools/content/encounter-environment.test.mjs.",
  "id": "rift_ferry",
  "rows": [
    "..........",
    "..........",
    "......#...",
    "..........",
    "..........",
    "......#...",
    "..........",
    ".........."
  ],
  "partySpawns": [
    { "x": 0, "y": 3 },
    { "x": 0, "y": 4 },
    { "x": 1, "y": 3 },
    { "x": 1, "y": 4 }
  ],
  "enemySpawns": [
    { "x": 9, "y": 3 },
    { "x": 9, "y": 4 },
    { "x": 8, "y": 2 },
    { "x": 8, "y": 5 }
  ]
}
