{
  "$comment": "Open passage between displaced walls in the Bone Yard; dark tiles are impassable rubble.",
  "id": "riftlight_bone_yard",
  "rows": [
    "..........",
    "..........",
    ".###..##..",
    "..........",
    "..........",
    ".##..##...",
    "..........",
    ".........."
  ],
  "partySpawns": [
    {
      "x": 0,
      "y": 3
    },
    {
      "x": 0,
      "y": 4
    },
    {
      "x": 1,
      "y": 3
    },
    {
      "x": 1,
      "y": 4
    }
  ],
  "enemySpawns": [
    {
      "x": 9,
      "y": 3
    },
    {
      "x": 9,
      "y": 4
    },
    {
      "x": 8,
      "y": 2
    },
    {
      "x": 8,
      "y": 5
    }
  ]
}
