{
  "$comment": "A rush road choked with wagons: two broken lines of carts with gaps to slip through. Gemfall's caravan roads and depots.",
  "id": "roadside",
  "rows": [
    "..........",
    "..........",
    ".###..##..",
    "..........",
    "..........",
    ".##..##...",
    "..........",
    ".........."
  ],
  "partySpawns": [
    {
      "x": 0,
      "y": 3
    },
    {
      "x": 0,
      "y": 4
    },
    {
      "x": 1,
      "y": 3
    },
    {
      "x": 1,
      "y": 4
    }
  ],
  "enemySpawns": [
    {
      "x": 9,
      "y": 3
    },
    {
      "x": 9,
      "y": 4
    },
    {
      "x": 8,
      "y": 2
    },
    {
      "x": 8,
      "y": 5
    }
  ]
}
